{
  "$schema": "../../schemas/real-response-scenario.schema.json",
  "schema_version": "disaster-decision.real-response-scenario.v1",
  "scenario_id": "kumamoto-2026-full-incident-demonstration-v1",
  "title": "Kumamoto 2026: the full first seventy-two hours through eleven decision moments",
  "disclosure": "This demonstration campaign extends the frozen five-slot reconstruction across the first seventy-two hours. The historical timeline and public observations remain source-bounded. Agent choices are simulated counterfactuals, use the same three graph methods and frozen model sampling settings, and support descriptive comparison only. They are not registered claims and do not show that a simulated choice was better, that responders were wrong, or that lives would have been saved.",
  "incident": {
    "occurred_at": "2026-07-28T16:27:15.200+09:00",
    "timezone": "Asia/Tokyo",
    "event_source_id": "source-jma-mainshock-sequence"
  },
  "sources": [
    {
      "source_id": "source-jma-mainshock-sequence",
      "title": "JMA main-shock bulletin sequence, normalized with all seven revisions preserved",
      "provider": "Japan Meteorological Agency",
      "url": "https://www.jma.go.jp/bosai/quake/data/list.json",
      "source_role": "TIME_AVAILABLE_INPUT",
      "sha256": "7f5aabb83b021bec9d5b6019684ffb68bc327925e71a204a7a841101b3d82377",
      "note": "The 16:31:48 and 16:35:28 municipality bulletins are the time-bounded input; the 20:30 depth revision is later and forbidden before its time."
    },
    {
      "source_id": "source-fdma-report-60",
      "title": "FDMA Kumamoto earthquake response report 60",
      "provider": "Fire and Disaster Management Agency",
      "url": "https://www.fdma.go.jp/disaster/info/items/20260728kumamotojishin60.pdf",
      "source_role": "HISTORICAL_CHOICE_RECORD",
      "sha256": null,
      "note": "A cumulative later report used to reconstruct real mobilization choices and later outcomes; it is never exposed as a contemporaneous first-night input."
    },
    {
      "source_id": "source-mlit-report-1-1810",
      "title": "MLIT situation report 1, 2026-07-28 18:10 JST",
      "provider": "Ministry of Land, Infrastructure, Transport and Tourism",
      "url": "https://www.mlit.go.jp/common/002014075.pdf",
      "source_role": "TIME_AVAILABLE_INPUT",
      "sha256": null,
      "note": "Carries the first liaison table and the infrastructure picture available at 18:10."
    },
    {
      "source_id": "source-prefecture-meeting-1",
      "title": "Kumamoto Prefecture disaster headquarters meeting 1 minutes, 2026-07-28 20:00 JST",
      "provider": "Kumamoto Prefecture",
      "url": "https://www.pref.kumamoto.jp/uploaded/attachment/315985.pdf",
      "source_role": "HISTORICAL_CHOICE_RECORD",
      "sha256": null,
      "note": "Later-published minutes of a contemporaneous meeting; only facts stated in the meeting are treated as available at 20:00."
    },
    {
      "source_id": "source-mlit-report-2-2150",
      "title": "MLIT situation report 2, 2026-07-28 21:50 JST",
      "provider": "Ministry of Land, Infrastructure, Transport and Tourism",
      "url": "https://www.mlit.go.jp/common/002014121.pdf",
      "source_role": "LATER_OUTCOME_CONTEXT",
      "sha256": null,
      "note": "Carries the later addition of a municipal liaison pair for Yatsushiro; forbidden at the 18:10 slot."
    },
    {
      "source_id": "source-mlit-water-1200",
      "title": "MLIT emergency water-supply posture, 2026-07-29 12:00 JST",
      "provider": "Ministry of Land, Infrastructure, Transport and Tourism",
      "url": "https://www.mlit.go.jp/common/002014163.pdf",
      "source_role": "TIME_AVAILABLE_INPUT",
      "sha256": null,
      "note": "Carries the then-current approximately 84,000-household outage picture, existing requests and truck commitments, and the real push-support choice."
    },
    {
      "source_id": "source-kantei-crisis-log",
      "title": "Prime Minister's Office crisis log for the 2026 Kumamoto earthquake",
      "provider": "Prime Minister's Office of Japan",
      "url": "https://www.kantei.go.jp/jp/kikikanri/earthquake20260728.html",
      "source_role": "HISTORICAL_CHOICE_RECORD",
      "sha256": null,
      "note": "Used only for statements with an explicit time in the public crisis log."
    },
    {
      "source_id": "source-cabinet-report-0730",
      "title": "Cabinet Office situation report, 2026-07-30 06:30 JST",
      "provider": "Cabinet Office of Japan",
      "url": "https://www.bousai.go.jp/updates/r8kumamoto_jishin/status/pdf/r8kumamoto_jishin_20260730.pdf",
      "source_role": "LATER_OUTCOME_CONTEXT",
      "sha256": null,
      "note": "Used only as later context; its approximately 108,100-household water figure is forbidden at the 2026-07-29 12:00 slot."
    },
    {
      "source_id": "source-prefecture-meeting-2",
      "title": "Kumamoto Prefecture disaster headquarters meeting 2 minutes, 2026-07-29 00:00 JST",
      "provider": "Kumamoto Prefecture",
      "url": "https://www.pref.kumamoto.jp/uploaded/attachment/315986.pdf",
      "source_role": "HISTORICAL_CHOICE_RECORD",
      "sha256": null,
      "note": "Carries the first-night rescue, water and coordination picture."
    },
    {
      "source_id": "source-prefecture-meeting-3",
      "title": "Kumamoto Prefecture disaster headquarters meeting 3 minutes, 2026-07-29 09:30 JST",
      "provider": "Kumamoto Prefecture",
      "url": "https://www.pref.kumamoto.jp/uploaded/attachment/315988.pdf",
      "source_role": "TIME_AVAILABLE_INPUT",
      "sha256": null,
      "note": "Carries the first recorded site rescue counts."
    },
    {
      "source_id": "source-prefecture-meeting-4",
      "title": "Kumamoto Prefecture disaster headquarters meeting 4 minutes and materials, 2026-07-29 16:00 JST",
      "provider": "Kumamoto Prefecture",
      "url": "https://www.pref.kumamoto.jp/uploaded/attachment/315989.pdf",
      "source_role": "TIME_AVAILABLE_INPUT",
      "sha256": null,
      "note": "Carries the detailed two-site rescue picture and eight-municipality water allocation."
    },
    {
      "source_id": "source-prefecture-meeting-5",
      "title": "Kumamoto Prefecture disaster headquarters meeting 5 minutes, 2026-07-30 09:30 JST",
      "provider": "Kumamoto Prefecture",
      "url": "https://www.pref.kumamoto.jp/uploaded/attachment/315990.pdf",
      "source_role": "HISTORICAL_CHOICE_RECORD",
      "sha256": null,
      "note": "Carries the recorded turn from life-saving activity toward water support."
    },
    {
      "source_id": "source-prefecture-meeting-6",
      "title": "Kumamoto Prefecture disaster headquarters meeting 6 minutes, 2026-07-30 16:00 JST",
      "provider": "Kumamoto Prefecture",
      "url": "https://www.pref.kumamoto.jp/uploaded/attachment/315992.pdf",
      "source_role": "LATER_OUTCOME_CONTEXT",
      "sha256": null,
      "note": "Carries later rescue status and the on-site national headquarters arrival."
    },
    {
      "source_id": "source-prefecture-headquarters-index",
      "title": "Kumamoto Prefecture disaster headquarters meeting index",
      "provider": "Kumamoto Prefecture",
      "url": "https://www.pref.kumamoto.jp/soshiki/222/274487.html",
      "source_role": "TIME_AVAILABLE_INPUT",
      "sha256": null,
      "note": "Records the eight prefectural meeting clocks inside the seventy-two-hour window."
    },
    {
      "source_id": "source-prefecture-shelter-feed",
      "title": "Kumamoto Prefecture event shelter feed",
      "provider": "Kumamoto Prefecture",
      "url": "https://portal.bousai.pref.kumamoto.jp/data/shelter/shelter.json",
      "source_role": "TIME_AVAILABLE_INPUT",
      "sha256": null,
      "note": "The feed mixes nominal, opening and publication timestamps; only aggregate counts are used."
    },
    {
      "source_id": "source-cabinet-report-0729-0700",
      "title": "Cabinet Office situation report, 2026-07-29 07:00 JST",
      "provider": "Cabinet Office, Government of Japan",
      "url": "https://www.bousai.go.jp/updates/r8kumamoto_jishin/status/pdf/r8kumamoto_jishin_20260729.pdf",
      "source_role": "TIME_AVAILABLE_INPUT",
      "sha256": null,
      "note": "First aggregated national damage, rescue, evacuation and shelter picture."
    },
    {
      "source_id": "source-cabinet-report-0729-1400",
      "title": "Cabinet Office situation report, 2026-07-29 14:00 JST",
      "provider": "Cabinet Office, Government of Japan",
      "url": "https://www.bousai.go.jp/updates/r8kumamoto_jishin/status/pdf/r8kumamoto_jishin_20260729-1400.pdf",
      "source_role": "TIME_AVAILABLE_INPUT",
      "sha256": null,
      "note": "Carries the changed rescue assignments, one isolated community and the daytime shelter aggregate."
    },
    {
      "source_id": "source-cabinet-report-0731-0730",
      "title": "Cabinet Office situation report, 2026-07-31 07:30 JST",
      "provider": "Cabinet Office, Government of Japan",
      "url": "https://www.bousai.go.jp/updates/r8kumamoto_jishin/status/pdf/r8kumamoto_jishin_20260731.pdf",
      "source_role": "LATER_OUTCOME_CONTEXT",
      "sha256": null,
      "note": "Carries the seventy-two-hour shelter, evacuation, fire and medical posture."
    },
    {
      "source_id": "source-mlit-road-snapshot-0729-0500",
      "title": "MLIT Passable Map road-restriction snapshot, 2026-07-29 05:00 JST",
      "provider": "Ministry of Land, Infrastructure, Transport and Tourism",
      "url": "https://www.mlit.go.jp/road/content/002014124.html",
      "source_role": "TIME_AVAILABLE_INPUT",
      "sha256": null,
      "note": "Carries 29 observed restriction geometries; 23 have a reported start minute and six are snapshot-only."
    },
    {
      "source_id": "source-mlit-report-6-0730-0630",
      "title": "MLIT situation report 6, 2026-07-30 06:30 JST",
      "provider": "Ministry of Land, Infrastructure, Transport and Tourism",